{"audit":{"dataset_reads":0,"model_loads":1,"network_requests":0,"provider_requests":0},"claims":{"bf16_q4_bit_exact":false,"diagnostic_only":true,"formal":false,"full_generation_kv_shared":false,"multi_stream":false,"quality_validated":false,"training_authorized":false,"zero_copy":false},"config_sha256":"6d81bb25c623aa6167d73479da8457ac3fa70af80e02febd8d154cf13f3701cb","gates":{"adapter_effect":true,"all_passed":true,"argmax":true,"finite":true,"greedy":true,"memory":true,"missing_trigger":true,"paired_differential":true,"prefix_kv":true,"shapes":true},"metrics":{"adapter_effect_max_abs":0.20517587661743164,"all_finite":true,"alora_argmax_equal":true,"alora_full_split_max_abs":6.67572021484375e-05,"base_argmax_equal":true,"base_full_split_max_abs":4.1961669921875e-05,"greedy_tokens_equal":true,"missing_trigger_effect_max_abs":0.0,"paired_differential_max_abs":4.863739013671875e-05,"shapes_equal":true},"model_identity":{"config_json_sha256":"c8452f8fd6e5c77d93c1529d17931008566fdfb88f1eb207b12b5e6ec3236c17","id":"Qwen/Qwen2.5-1.5B-Instruct","model_safetensors_sha256":"dd924a11b4c220f385b51ffa522daea7c9f3d850e31b162bb5661df483c6d3ee","source_revision":"3c3787b7c81927cc64ad45dc32ff1c9ce2a5de34","tokenizer_config_sha256":"fa2a40a9d8c8c4bb7f25ab726eb78ec9cbaaef96d1fa26f1d7f5615e886449a8","tokenizer_json_sha256":"47ec9be242d3ef39b9c97ac0a3f06c1752f061b234e295bc0a2842067a3fe4f9"},"routes":{"adapter_kind":"alora","adapter_saved":false,"alpha":8,"cache_layers":28,"executed":["base_full","base_split","alora_full","alora_split","missing_trigger_active","missing_trigger_off","prefix_active","prefix_off"],"full_cache_tokens":48,"planner_private_kv_reused":false,"planner_request_executed":false,"prefix_cache_tokens":30,"prefix_kv_bit_equal":true,"rank":4,"reuse_scope":"exact_r2_pre_invocation_base_prefix_only","target_modules":["q_proj"],"training_steps":0},"runtime":{"attention_implementation":"eager","cublas_workspace_config":":4096:8","cuda":"12.1","dtype":"float32","gpu":"NVIDIA GeForce RTX 3080 Ti","peak_allocated_mib":5954.57373046875,"peak_reserved_mib":6058.0,"peft":"0.19.1","python":"3.11.15","tf32":false,"torch":"2.5.1+cu121","transformers":"5.13.0"},"schema_version":"anchor.qwen-alora-prefix-kv-diagnostic-receipt.v1","status":"passed","tokenization":{"boundary_overhang_sha256":"86425446211d57350bc0776b6be6fe818b6df8d795bdad71264bd418ec754064","chat_template_sha256":"cd8e9439f0570856fd70470bf8889ebd8b5d1107207f67a5efb46e342330527f","complete_request_tokenized_once":true,"continuation_tokens":18,"full_tokens":48,"invocation_tokens":7,"isolated_trigger_encoding_authoritative":false,"ordered_token_ids_sha256":"310ae9dde218ec72b2d114872986301c2c39aeaedf70fe947c89b03bdcbd3916","post_invocation_tokens":11,"prefix_token_ids_sha256":"322816d20268a5be64a7c2600d0d1ffc6cea637ccefa6846f4056ced19a21564","prefix_tokens":30,"request2_utf8_sha256":"0e2d1b5bbcb1b880a9cc2436b02f0b97aff7787501498a136174d7392f0ca135","trigger_span_end":37,"trigger_span_start":30,"trigger_text_occurrences":1,"trigger_text_sha256":"edbf9bbe304daa9847c6f0c4b543c56325a32c899e030b0bf870820c596b9884"}}
